assessmentId,internalTaxonId,scientificName,redlistCategory,redlistCriteria,yearPublished,assessmentDate,criteriaVersion,language,rationale,habitat,threats,population,populationTrend,range,useTrade,systems,conservationActions,realm,yearLastSeen,possiblyExtinct,possiblyExtinctInTheWild,scopes
18236352,202618,Ichthyomyzon fossor,Least Concern,,2013,2012-02-17 00:00:00 UTC,3.1,English,"Listed as Least Concern in view of the large extent of occurrence, large number of subpopulations and locations, and probable large population size, and because the species probably is not declining fast enough to qualify for any of the threatened categories.","Habitat includes clean, clear gravel riffles and runs of small rivers (Page and Burr 2011); this species usually does not occur in large rivers or small brooks. Usually it occurs over gravel or sand-silt bottoms in moderately warm water, generally unsuitable for brook trout (Becker 1983). Larvae burrow into sand-silt bottoms in eddies. Spawning occurs in coarse gravelly or stony bottoms of creeks or small rivers in areas of strong current.","No major threats are known, but the species is vulnerable to local extirpation through indiscriminant use of fish toxicants (Becker 1983).","This species is represented by a large number of occurrences (subpopulations). Becker (1983) mapped several dozen collection sites in Wisconsin, representing probably a few dozen distinct occurrences; he stated that the species is probably more widely distributed than present records indicate. Pflieger (1997) mapped 18 collection sites (1945-1995) in three well-isolated river systems in Missouri; he stated that due to identification problems with larvae, the species may be more widely distributed that available records suggest. Burr and Warren (1986) mapped 18 collection sites in several drainages Kentucky; these represent probably about a dozen distinct occurrences, but the species was rated as threatened there. Smith (1979) mapped three collection sites in Illinois all in one river.<br/><br/>Total adult population size is unknown but presumably exceeds 10,000. Rage-wide, this species is locally common (Page and Burr 2011); occasional and uncommon in Kentucky (Burr and Warren 1986); common in at least two river systems in Wisconsin (Becker 1983).<br/><br/>Trend over the past 10 years or three generations is uncertain but probably relatively stable or slowly declining.",Unknown,"Range extends from the St. Lawrence River, Quebec, west through Great Lakes and northern Mississippi River basins to Red River (Hudson Bay basin), southern Manitoba; localized in Ohio River basin from northwestern Pennsylvania to eastern Kentucky; Missouri River basin, Ozark Uplands, Missouri (Pflieger 1997, Page and Burr 2011)",,Freshwater (=Inland waters),"Currently, this species is of relatively low conservation concern and does not require significant additional protection or major management, monitoring, or research action.",Nearctic,,false,false,Global
18236707,202617,Ichthyomyzon castaneus,Least Concern,,2013,2012-02-17 00:00:00 UTC,3.1,English,"Listed as Least Concern in view of the large extent of occurrence, large number of subpopulations, large population size, apparently stable trend, and lack of major threats.","Adults live in medium and large rivers; larvae burrow in bottom of smaller tributaries in areas of moderate current, later move into more densely vegetated areas with softer bottom (Scott and Crossman 1973). Adults also occur in large reservoirs. Eggs are laid in a nest in the river bottom; may cover eggs with stones (Becker 1983).",No major threats are known.,"This species is represented by a large number of occurrences (subpopulations).<br/><br/>Total adult population size is unknown but presumably exceeds 10,000. This species is locally common (Page and Burr 2011).<br/><br/>Trend over the past 10 years or three generations is uncertain but likely relatively stable.",Stable,"Range includes the Great Lakes (e.g., see Renaud et al. 1996), St. Lawrence River, and Mississippi River basins from Ontario, Quebec (Renaud and de Ville 2000), Michigan, Wisconsin, and Minnesota south to Louisiana, and from eastern Tennessee west to eastern Kansas and Oklahoma; Red River (Hudson Bay basin), Manitoba, Saskatchewan, Minnesota, and North Dakota; Gulf Coast drainages from Mobile Bay, Georgia and Alabama, to Sabine Lake, Texas (Page and Burr 2011).",,Freshwater (=Inland waters),"Currently, this species is of relatively low conservation concern and does not require significant additional protection or major management, monitoring, or research action.",Nearctic,,false,false,Global
19849321,19514118,Lampetra ninae,Near Threatened,,2014,2013-03-18 00:00:00 UTC,3.1,English,"This species is known from streams in the east Black Sea basin, Georgia. It is being impacted by the construction of dams and other river regulations which are quickly being developed in the area. While the species is known from more then 10 independent streams (treated as separate locations based on threat from dams), it is believed to be declining. The actual rate of population decline is unknown, but it is suspected to be close to 30% over the past 10 years. The species is assessed as Near Threatened because it is likely to nearly qualify for Vulnerable under criterion A2.","<span class=""Absatz-Standardschriftart1"">Piedmont zones in clear well oxygenated brooks. Ammocoetes live in detritus-rich sands or clay sediments.","There are many threats in the area. The most important threats to this species are the construction of dams, and other river regulations which are being quickly being developed in the area.","There are no data about population trends in this species, but it is believed to be declining due to many ongoing threats across its range.",Decreasing,"<span class=""Absatz-Standardschriftart1"">East Black Sea basin from: Shakhe and Mzymta rivers, and Chakhtsutsyr brook in Russia south to Bzyb’ and Mokva rivers in Abkhazia (Georgia).",,Freshwater (=Inland waters),"This species is strongly affected by the construction of dams and other types of river regulations going on in the area. Still, it is believed to be quite widespread but concrete data are scare. Some field work is strongly recommended to better understand the&#160;distribution&#160;and the active threats in the area.",Palearctic,,false,false,Global
76578043,202621,Ichthyomyzon unicuspis,Least Concern,,2015,2012-02-22 00:00:00 UTC,3.1,English,"Listed as Least Concern in view of the large extent of occurrence, large number of subpopulations, large population size, apparently stable trend, and lack of major threats.","Adults feed in lakes, reservoirs, and large rivers (Page and Burr 2011). Larvae burrow into mud and silt in pools or at margins of rivers after drifting downstream from spawning areas. <br/><br/>Eggs are laid in nests in gravelly riffles in medium-sized streams with moderate gradient.","No major threats are known. Locally, possible threats include habitat modification (e.g., impoundments, dredging) and pollution.","This species is represented by a large number of occurrences (subpopulations).<br/><br/>Total adult population size is unknown but presumably exceeds 10,000. This species is regarded as uncommon (Page and Burr 1991); moderately abundant in Tennessee (Etnier and Starnes 1993).<br/><br/>Trend over the past 10 years or three generations is uncertain but likely relatively stable.",Stable,"Range includes the St. Lawrence-Great Lakes basin from Quebec to southwestern Ontario, south through upper Mississippi and Ohio river basins to central Tennessee; Hudson Bay basin, Manitoba; and Missouri River (Nebraska) and Mississippi River (Mississippi) (Page and Burr 2011).",,Freshwater (=Inland waters),"Currently, this species is of relatively low conservation concern and does not require significant additional protection or major management, monitoring, or research action.",Nearctic,,false,false,Global
76578331,202624,Lethenteron appendix,Least Concern,,2015,2012-02-23 00:00:00 UTC,3.1,English,"This species is listed as Least Concern in view of the large extent of occurrence, large number of subpopulations, probably large population size, apparently stable trend, and lack of major threats.","Habitat of adults includes gravel-sand riffles and runs of creeks and small to medium rivers with strong flow (Page and Burr 2011); cool, clear water; tidal freshwater in Massachusetts (Hoff 1988). Larvae burrow into sand and silt, often in pools or slow water near shore. Adults usually found in breeding areas. Eggs are laid in nests in gravel/sand riffles and runs with strong flow.",No major threats are known.,"This species is represented by a large number of occurrences (subpopulations).<br/><br/>Total adult population size is unknown but presumably exceeds 10,000. This species is regarded as uncommon (Page and Burr 2011).<br/><br/>Trend over the past 10 years or three generations is uncertain but likely to be relatively stable.",Stable,"Range includes the Atlantic, Great Lakes, and Mississippi River basins from St. Lawrence River, Quebec, west to Minnesota, south to Chowan River system, Virginia, Tennessee River system, northern Alabama, and St. Francis and White river systems, Missouri and Arkansas (Page and Burr 2011).",,Freshwater (=Inland waters),"Currently, this species is of relatively low conservation concern and does not require significant additional protection or major management, monitoring, or research action.",Nearctic,,false,false,Global
81468224,11208,Entosphenus macrostoma,Endangered,B1ab(iii)+2ab(iii),2017,2015-07-22 00:00:00 UTC,3.1,English,"The species is endemic to Cowichan and Mesachie lakes (which are connected) and their lower in-flowing tributaries, on southern Vancouver Island, British Columbia. The species is currently threatened by a decline in its primary prey species (Coho Salmon, <em>Oncorhynchus kisutch</em>), and also by sedimentation from logging, and persecution from recreational anglers. It has an area of occupancy (AOO) of 65 km², and an extent of occurrence (EOO) of 106 km², and is known from only one location based on the major threat to the species. Therefore the species is assessed as Endangered.","The species spawns on shallow gravel bars in nearshore lake habitat. After hatching, the larval lampreys (ammocoetes) burrow into soft fine sediments or sand. The juvenile lampreys likely seek prey (young salmonids especially coho salmon) in the open lake (COSEWIC 2008). After spawning the adults die.","There has been a significant decline in the abundance of their most commonly observed prey (Coho Salmon, <em>Oncorhynchus kisutch</em>). The species is also persecuted by recreational anglers, and logging is leading to siltation of littoral spawning areas. Potential threats include development for residential and industrial uses on littoral areas and increasing levels of water extraction (leading to water level fluctuations).","It is estimated that there is between 1,000 and 2,000 individuals in both lakes, but this needs quantifying (COSEWIC 2008).&#160;Changes in salmonid scarring rates (an index of the number of adult lampreys) suggest that the number of Vancouver Lampreys in 1987-1996 (in Mesachie Lake, at least) are lower than they were prior to 1982, however current population trends are unknown.",Unknown,"The species is endemic to&#160;Cowichan and Mesachie lakes (which are connected) and their lower in-flowing tributaries, on southern Vancouver Island, British Columbia,&#160;Canada (COSEWIC 2008). Its area of occupancy is estimated at 65 km² (area of the lake), and its extent of occurrence (based on a minimum convex polygon) is 106 km². The species occurs at only one location, based on the main threat affecting the species.",,Freshwater (=Inland waters),"There is a recovery strategy for the species (Vancouver Lamprey Recovery Team 2007), which aims to increase the scientific understanding of the species, improve awareness of the species and engage with local stakeholders and maintain and improve the species population and habitat integrity.",Nearctic,,false,false,Global
97802578,8173,Eudontomyzon mariae,Least Concern,,2011,2010-03-05 00:00:00 UTC,3.1,English,"A widespread species and abundant in Poland and Ukraine. However it is suspected to be undergoing a slow population decline with recent and on-going economic development, but not at a rate to qualify for a threatened or Near Threatened category.<br/><br/>    <p>European Union 27 = LC. Same rationale as above.</p>","<strong>Habitat</strong>: <br/>Lowland, piedmont and montane zones in clear, well oxygenated brooks. Ammocoetes in detritus-rich sands or clay sediments. <br/><br/><strong>Biology</strong>: <br/>Non-predatory, freshwater resident. Ammocoetes stage lasts 3.5-4.5 years. Feeds on detritus and micro-organisms, metamorphoses in September-December, overwinters and spawns in late April-early May, later at higher elevations, when temperatures reach 11-16°C. Spawning individuals cease their normal daylight avoidance reaction and reproduce on sunny days. Males dig a shallow nest in habitats with moderate current. Spawners form aggregations. Dies after spawning.",Locally threatened by damming in headwaters and pollution.,"Abundant in Poland and Ukraine, but suspected to be gradually declining overall.",Decreasing,"Tributaries of Baltic (Odra, Vistula, Neman drainages), northern Black (Danube to Kuban drainages) and Caspian Seas (River Sura, Volga drainage). In Danube, restricted to tributaries below Iron Gate; a single record from upper Morava system (Czechia).",,Freshwater (=Inland waters),No information available.,Palearctic,,false,false,Global & Europe
97805807,11206,Lampetra fluviatilis,Least Concern,,2011,2010-03-05 00:00:00 UTC,3.1,English,"Still rare in some areas, but populations have markedly recovered following earlier pollution problems in central and western Europe.<br/><br/>    <p>European Union 27 = LC. Same rationale as above.</p>","<strong>Habitat</strong>: <br/>Adults live in coastal waters and estuaries and spawn in strong-current habitats of rivers and streams. Ammocoetes burrow in detritus-rich sands or clay sediments. <br/><br/><strong>Biology</strong>: <br/>Predatory, with anadromous and landlocked populations. Adults migrate into rivers from autumn to spring. Migration is mainly nocturnal and ceases at low temperatures. Spawning season starts when water temperature rises above 9°C, which depends on latitude, starting in late March in France and mid-June in Finland. Spawning individuals cease their normal daylight avoidance reaction and reproduce on sunny days. Males dig shallow nests in habitats with fast current. Spawners form large aggregations. Adults die after spawning. Ammocoetes stage lasts 2½-3½ years. Ammocoetes feed on detritus and micro-organisms. After metamorphosis (from late summer to late autumn), most juveniles overwinter in freshwater and migrate to the sea in spring. At sea, adults prey on a wide variety of fish species, mostly Clupeidae and Gadidae. Feeds on body tissues of prey, which is usually killed while its flesh is excavated. Adults feed for 2 (rarely 1) summers before migrating to the spawning grounds. Individuals feeding for only a single summer before breeding are smaller. Landlocked population of Loch Lomond feeds for only one summer, then stops feeding and migrates in autumn to spawning grounds in River Endrick.",No major threats known.,Abundant.,Unknown,"Ireland, Great Britain north to Scotland, Atlantic coast of   Portugal (maybe extirpated), France, North Sea north to Scotland and about Bergen (Norway), North and Baltic Sea basins; Mediterranean along French and western Italian coasts   (maybe all extirpated). Occasional records in Adriatic and Ionian Seas and along coasts of Iberian Peninsula. Migrates into rivers of this area. Landlocked populations known from Lakes Ladoga and Onega (Russia), Loch Lomond (Scotland), some lakes in Finland and possibly Lough Neagh (Ireland).",This species is harvested for human consumption.,Freshwater (=Inland waters),No information available.,Palearctic,,false,false,Global & Europe
97806694,11213,Lampetra planeri,Least Concern,,2011,2010-03-05 00:00:00 UTC,3.1,English,"Still rare in some areas, but populations have markedly recovered following earlier pollution problems in central Europe.<br/><br/>    <p>European Union 27 = LC. Same rationale as above.</p>","<strong>Habitat</strong>:<br/>Found in the lowland, piedmont and montane zone in clear, well oxygenated brooks. Ammocoetes live in detritus-rich sands or clay sediments. <br/><br/><strong>Biology</strong>: <br/>Non-predatory, freshwater resident. Timing of spawning season depends on latitude when temperature exceeds 9°C, starting in February in Italy and mid-June in Finland. Spawning individuals cease their normal daylight avoidance reaction and reproduce on sunny days. Males dig a shallow nest in habitats with moderate current. Spawners form large aggregations. Dies after spawning. Single individuals may survive until September. Ammocoetes stage usually lasts 2<sup>1</sup>/<sub>2</sub>-3 <sup>1</sup>/<sub>2</sub> years. Feeds on detritus and micro-organisms, starts metamorphosis in June-July (fully transformed individuals usually found in September), overwinters and spawns following spring. There are indications that <em>L. planeri</em> might be an heterogeneous (polyphyletic) assemblage of several lineages evolved independently from different populations of <em>L. fluviatilis</em> (see family introduction).",No major threats known.,Abundant.,Unknown,"Great Britain north to Scottish highlands, rivers draining to North Sea north to Scotland and about Stavanger (Norway), Baltic Sea basin, Atlantic as far south as Adour drainage (France, Spain) and an isolated population in Tagus (Portugal), Mediterranean basin in France and western Italy (south to about Tevere drainage). Locally in Ireland, upper Volga, upper Danube and some of their tributaries, and Pescara drainage on Adriatic coast of Italy.",,Freshwater (=Inland waters),No information available.,Palearctic,,false,false,Global & Europe
123382016,122898736,Mordacia mordax,Least Concern,,2019,2019-02-12 00:00:00 UTC,3.1,English,"This species is assessed as Least Concern. Populations in New South Wales are considered stable. Population trends in Victoria and Tasmania are unknown, and it is now rarely encountered in South Australia.","<p>Most of this species' adult life is spent at sea or in estuaries. Young adults migrate upstream&#160;from the sea in spring and summer to breed in rivers. The spawning run lasts for about&#160;a year, before adults spawn the following spring, from August–November. During the&#160;spawning run, individuals are usually active nocturnally, and burrow into the substrate&#160;during the day. Females lay 3,800–13,400 small eggs, (0.3–0.5 mm diameter), which are&#160;deposited in a shallow nest (small depression) in the substrate, often in shallow, relatively&#160;fast water. Adults die shortly after spawning. Ammocoetes are sedentary and live in slow-flowing streams, burrowing in silt or mud, for three to four years before metamorphosing (at around 100–140 mm length) and migrating down to the sea, usually in spring (Lintermans 2007). The length of the marine phase of the life-cycle is unknown, but estimated as at least 1.5 years.&#160;</p>","<p>The primary threat to lamprey species appears to be major catchment modifications to hydrology, habitat and fish movement. Reduced stream and river flows (e.g. farm dams and water storages) are affecting the amount of wetted habitat available, the quality of remaining habitat (e.g. less dissolved oxygen and increased temperatures with decreased flows) and connectivity for migration (Hammer <em>et al.</em>&#160;2007).&#160;Barriers to fish movement can interfere with spawning migrations, although the species can&#160;climb wet vertical surfaces (Lintermans 2007).</p><p><br/></p><p></p><p></p>","There is no published quantitative information available relating to current or predicted population trends for this species in any jurisdiction. NSW DPI has time series data from six localities occupied by the species spanning 18 years (three generation lengths). The weighted average trend in CPUE through time (R = -0.06651), which is not significantly different from no change.",Stable,"<p>This Australian endemic species is found throughout freshwater and coastal marine systems of south-eastern Australia. Its range encompasses the river systems and offshore waters from near Adelaide in South Australia, throughout Tasmania and Victoria and north along the NSW coastline to near Sydney. It extends moderate distances upstream in coastal rivers. However, in the Murray-Darling Basin it has been found as far upstream as Yarrawonga on the Murray River and Narrandera on the Murrumbidgee River.&#160;<br/><br/>The area of occupancy (AOO) based on known records is 1,088 km<sup>2</sup> but this is&#160;very likely to be an underestimate given the scarcity of sampling for this taxa throughout its EOO.</p>",This species is not currently used.,Freshwater (=Inland waters)|Marine,"There are no conservation actions in place for this species. Site management and restoration is recommended, as well as additional research and monitoring of the species.<p></p>",Australasian,,false,false,Global
132675777,169396,Tetrapleurodon spadiceus,Critically Endangered,D,2019,2018-12-04 00:00:00 UTC,3.1,English,"<em>Tetrapleurodon spadiceus</em>&#160;is restricted to Lago de Chapala, Mexico and a small stretch of Rio Grande de Santiago exiting the lake (a waterfall blocks further dispersal). Historically,&#160;<em>T. spadiceus</em>&#160;was found in the Rio Zula, Rio Duero, Lago de Cuitzeo and Rio Grande de Morelia. Despite extensive sampling in 1994, 1997 and 1998, this species has not been reported since 1987. Therefore, the population size is estimated to be less than 50, and is considered to be possibly extinct. As such, it is assessed as Critically Endangered (Possibly Extinct) under criterion D.","<em>T. spadiceus</em>&#160;is a parasitic, demersal species that inhabits streams, rivers and lakes over substrates of firm mud, silt and rock (Miller <em>et al</em>. 2005).  It spawns from December to January (O. Mejia pers. comm. 2018).","Lake Chapala and the surrounding rivers are suffering from severe habitat degradation.  This has been caused by defective administration of the water resource combined with the economic activity and population along its river basin.  This region is now one of the most eroded areas of the country (Living Lakes 2005).  <br/><br/>Eleven major dams upstream of the Lerma River were constructed in order to divert water for industry, drinking water and irrigation.  In the 1970s Lake Chapala had a volume of 8.1 billion m<sup>3</sup>.  The current volume is 1.3 billion m³ (Living Lakes 2005), therefore Lake Chapala's volume has reduced by 84% in approximately 35 years.  81% of the Lake Chapala catchment area is used for agriculture and the portion of irrigated areas quintupled in the last 50 years (Living Lakes 2005). Additionally, these dams restrict the migration of juveniles from small streams and tributaries into the lake (Lyons<em> et al</em>. 1994, O. Mejia pers. comm. 2018).<br/><br/>The water running into Lake Chapala through the river is highly polluted with heavy metals and other toxic substances as a result of insufficient waste water treatment.  Contamination of the water that supplies the lake has reached alarming levels, to the degree of causing toxicological mutations in some of the fish species that until now have survived in the vast lake.  Among the problems are the high levels of phosphorus (80 times higher than is permitted by the international standards), infestation of algae, presence of heavy metals (cyanide chromium, leads and mercury) and infestation of aquatic weeds (eutrophication). There is also a great concentration of organic residues from industrial waste products of the leather industry and the drainage of the cities in the basin (Living Lakes 2005).","Habitat modification and degradation of water quality have severely reduced&#160;the species&#160;distribution and abundance (Miller <em>et al</em>. 2005). Lyons <em>et al</em>. (1994) did not report a single specimen, despite extensive sampling in both basins where this species historically occurred. Additional sampling in 1997 and 1998 failed to record this species (O. Mejia pers. comm. 2018). Therefore, based on extensive sampling and no confirmed reports of this species since 1987 (Lyons <em>et al</em>. 1994), we estimate a population size that does not exceed 50.",Decreasing,"This severely restricted species occurs only in Lago de Chapala, Mexico and a small stretch of Rio Grande de Santiago exiting the lake (a waterfall blocks further dispersal).  Historically, <em>T. spadiceus</em> was found in the Rio Zula, Rio Duero, Lago de Cuitzeo and Rio Grande de Morelia (Lyons <em>et al</em>. 1994, Miller<em> et al</em>. 2005).",This species is not utilized.,Freshwater (=Inland waters),"<em>T. spadiceus</em>&#160;is listed as endangered in the Mexican Official Norm (SEMARNAT 2010). However, this listing has not resulted in any direct conservation actions.",Neotropical,1987,true,false,Global
