assessmentId,internalTaxonId,scientificName,redlistCategory,redlistCriteria,yearPublished,assessmentDate,criteriaVersion,language,rationale,habitat,threats,population,populationTrend,range,useTrade,systems,conservationActions,realm,yearLastSeen,possiblyExtinct,possiblyExtinctInTheWild,scopes
1375696,173021,Otocryptis beddomii,Endangered,B1ab(iii),2013,2010-12-27 00:00:00 UTC,3.1,English,"<span style=""font-style: italic;""></span><em></em>Listed as Endangered on the basis that it has an extent of occurrence of 2,500 km<sup>2</sup> encompassing two locations defined by a threat from land clearance and, while it is relatively common within its restricted distribution, there are threats from forest fires and forest management practices that are causing a decline in the quality and extent of its habitat, and which may cause local population declines.","<span style=""font-style: italic;"">Otocryptis beddomii</span> is a small sized terrestrial lizard commonly encountered among leaf-litter and forest floor vegetation in the Western Ghats. In the Shendurney Wildlife Sanctuary, the maximum number of juveniles sightings were in October (Jose <span style=""font-style: italic;"">et al. </span>2007).","<p><span style=""font-style: italic;"">Otocryptis beddomii</span> has been recorded around <span style=""font-style: italic;"">Myristica</span> swamps area in southern Kerala (Jose <span style=""font-style: italic;"">et al</span>. 2007) and this habitat was under threat due to conversion into agriculture lands and betelnut gardens. At present, clearing the forest edges for firelines disturbs the microhabitat of this species (Jose <span style=""font-style: italic;"">et al. </span>2007). <br/></p><p><br/></p><p><br/></p><p><br/></p>","It appears to be common in some lowland forests bordering <span style=""font-style: italic;"">Myristica</span> swamps. In Shendurney Wildlife Sanctuary and Kulthupuzha in Kollam district, Kerala the population density of this species was reported to be 4.25 individuals per hectare (Jose <span style=""font-style: italic;"">et al. </span>2007). Chandramouli (2009) reports that this species occurs in high abundance in the mid-elevation rainforest (300-600 m)",Stable,"<span style=""font-style: italic;"">Otocryptis beddomii</span> is endemic to the Western Ghats, India. It has been reported from Sivagiri Ghats in the Cardamom hills, Kerala, Ponmudi, Thiruvananthapuram district, Kerala, Anchal Forest Range, Kollam district, Kerala, Kulathapuzha, Kollam district, Kerala, Shendurney Wildlife Sanctuary, Kollam district Kerala, Kalakkad Munduthurai Tiger Reserve, Tamil Nadu (Smith 1935, Inger <span style=""font-style: italic;"">et al. </span>1984, Johnsingh 2001, Jose <span style=""font-style: italic;"">et al</span>. 2007, Chandramouli 2009). This species occurs at elevations between 150 and 1,100 m asl. The species has an estimated extent of occurrence between known sites of 2,500 km<sup>2</sup>; its area of occupancy, assuming that it occurs over a 50 km<sup>2</sup> area at each known locality, is taken to be 700 km<sup>2</sup>.",The species is not in use.,Terrestrial,"There are no known species-specific conservation measures in place for this species. <em></em>This species occurs in three protected areas, which comprises most of its distribution.",Indomalayan,,false,false,Global
2039836,192100,Gloydius shedaoensis,Vulnerable,D2,2012,2011-08-31 00:00:00 UTC,3.1,English,"Listed as Vulnerable because it is known from a single location&#160; (Snake Island), and it faces a plausible future threat from increases in drought conditions.","This species mainly inhibits in bushes and meadows, while also found in the edge of forest, ponds, roads and rocks. Feed on small birds and rats. Ovoviviparous. Gives birth every two years, with 2-7 young in August and September.","Before creation of the nature reserve, mowing, firewood collecting, hunting and natural fire were the main threats to this species. Additional problems include drought and vegetation succession (Tian et al. 2002).","Surveys indicate that the population is about 18,000 individuals in 2000 (Sun et al 2000, Tian et al. 2002). According to Liu (2008), the population in 2006 is of this species is 20,281±590 individuals. This species is vulnerable to climate fluctuation, e.g., about 3,000 individuals died in typhoons in 1984.",Unknown,"Known only from the type locality: Shedao (Snake Island), 24 nautical miles northwest of Lüshun (Port Arthur), Liaoning Province, China; Below 215 meters. (Zhao &amp; Alder 1993).&#160; Shedao is 0.73 km<sup>2</sup>, and 7 sea miles away from the nearest continent. It has coordinates of east longitude 120°59′, north latitude 38°57′ (Zhao 2006, Tian and Zhang 2002).","After the nature reserve has been established, all utilization is prohibited (Tian et al 2002).",Terrestrial,"A nature reserve was established in the island in the 1980's, which covers the whole range of this species (National Natural Reserve of Liaoning Snake island ). There is a need to monitor populations of this restricted range species.",Palearctic,,false,false,Global
2193044,193085,Valenciennea strigata,Least Concern,,2019,2017-06-20 00:00:00 UTC,3.1,English,"This species is widespread, and relatively common throughout its range. It is present in the aquarium trade, but there are no major threats known to impact it. It is listed as Least Concern.","This species is common in clear outer lagoon and seaward reefs, over hard bottoms as well as over sand and rubble.  This species is usually seen in pairs, hovering near their burrow.  This is a monogamous species (Whiteman and Côté 2004,  Kuiter and Tonozuka 2001), that feeds on small benthic invertebrates, fishes, and fish eggs by sifting mouthfuls of sand.  It displays distinct pairing (Reavis 1997).  Females spawn every 13 days while males guard the eggs which are laid in a burrow for 2-3 days (Reavis 1997).  Both sexes impose monogamy as a practise by guarding each other against other possible mates (Reavis 1997). Mate guarding is made possible because all males were able to hold a nest site, both sexes exhibit strong site fidelity, and residents have an advantage in contests over mates (Reavis 1997).",This species is regularly sold commercially in the aquarium trade (Burgess <em>et al.</em> 1990). There are no other threats known to this species.,"This species is not found in large numbers, but is relatively common and is one of the most common of its genus in coral reef areas (Reavis and Barlow 1998).",Unknown,"This species is found in the Indo-Pacific from East Africa to Tuamoto Islands, north to the Ryukyu Islands, south to Sydney, Australia, including Lord Howe Island (Hoese and Larson 1994).&#160;It is typical along reef-crests in depths of 1-6 m, but has also been collected from depths to 24 m.",This species is collected for the aquarium trade.,Marine,"This species occurs in marine protected areas within its range, but there are no species-specific conservation measures (IUCN-UNEP 2017).","",,false,false,Global
2317529,194346,Lutjanus malabaricus,Least Concern,,2019,2018-06-28 00:00:00 UTC,3.1,English,"This widely distributed species is common and abundant and inhabits a variety of benthic habitats over the continental shelf. It is a long-lived species with a long generation length.&#160;It is targeted by fisheries through much of its range and localised declines are known to have occurred in the Persian Gulf, Indonesia and other areas with heavy fishing pressure. However, its population is stable in Australia where it benefits from conservation measures that include stringent fishing regulation. This species is therefore listed as Least Concern.","This species inhabits a variety of benthic habitats&#160;on the continental shelf, including coastal and offshore reefs, shoal grounds and areas of flat bottom with occasional epibenthos or vertical relief (Newman 2002). It tends to be associated with sponge and gorgonian-dominated habitats on the North West Shelf (Sainsbury 1987), and hard mud areas of the Arafura Sea. In Australia, it frequently forms mixed shoals with <em>Lutjanus erythropterus</em>. Juveniles tend to inhabit shallow inshore waters and seagrass beds and larger fish live in deeper waters (McPherson <em>et al.</em> 1988). Maximum total length is 100 cm (Allen 1985). This species forages at night and feeds mainly on fish and small amounts of benthic crustaceans, cephalopods and other benthic invertebrates (Kailola <em>et al.</em> 1993). Spawning occurs throughout most of the year in lower latitudes with peak activity during spring and summer at New Caledonia and Australia (McPherson&#160;<em>et al</em>. 1992). Spawning occurs throughout the year in Australia and Indonesia (Fry&#160;<em>et al.</em>&#160;2009). This species is relatively slow-growing and long-lived; estimated&#160;natural mortality&#160;is 0.112, longevity is 48 years, maximum fork length is 80.2 cm, males reach maturity at about 24 cm and females at 25-30 cm (Newman 2002, Fry and Milton 2009, Fry<em>&#160;et al</em>. 2009).","<p>This species is heavily fished in some areas and over-fishing is occurring in the Persian Gulf and Indonesia (Blaber&#160;<em>et al.</em>&#160;2005, Salini<em>&#160;et al.&#160;</em>2006, Al-Husaini&#160;<em>et al.&#160;</em>2015). It is susceptible to over-exploitation due to its long-lived, slow-growing life history characteristics (Newman 2002, Fry and Milton 2009).</p>","This species is common and abundant in Australia (Blaber <em>et al.</em> 1994, Newman and Williams 1996, McLean<em> et al. </em>2017). Global fisheries statistics reported to FAO are incomplete (Pauly and Zeller 2015), only available for Iran and Qatar.<strong>&#160;</strong>The intensity of fishing effort and catch of this species in Indonesia is expected to be an order of magnitude greater than in Australia partly due to its higher market value there, but little quantitative data are available to determine population trends (Salini<em>&#160;et al.&#160;</em>2006). Indonesian snapper fisheries have been expanding since about 1990 (Blaber&#160;<em>et al.</em>&#160;2005). A study by Nuraini and Ernawati (2009) reported significant declines in catch per unit effort and fish size during the 2000's in the Arafura Sea fisheries management area. According to genetics studies by Salini&#160;<em>et al</em>. (2006), the populations in Indonesia and Australia are separate and populations between Kupang in eastern Indonesia and the Australian Timor Sea are also separate. The stocks of this species in Western Australia, Queensland and Northern Territory, Australia are considered to be 'sustainable' and not over-fished. In addition, the current harvest rate is well below maximum sustainable yield (Martin&#160;<em>et al</em>. 2014, Northern Territory Government 2015). In the Persian Gulf, this species is&#160;one of the principal market fishes.<em>&#160;</em>During a&#160;trawl survey conducted in 2003 to 2004 in the Persian Gulf and Gulf of Oman, this species comprised&#160;3.1% and 0.06%&#160;of the total biomass, respectively (Valinassab&#160;<em>et al.&#160;</em>2006). Abu Dhabi Emirate fisheries landed an average of 20.8 tonnes of this species from&#160;2006 to 2012. A peak of 111.8 tonnes were landed in 2009, followed by a decline to 0.7 tonnes in 2012. In Bahrain, 0.5 mt were landed in 2009 and 0 mt in 2010 and 2011. From 1995 to 2013, landings of this species in Kuwait declined by about 79% from 137 mt to 29 mt and is considered over-fished (Al-Husaini <em>et al. </em>2015).<strong><br/></strong><strong><br/></strong>",Unknown,"This species is widespread in the Indo-West Pacific from Fiji to the Arabian Sea and Persian Gulf, and from Australia (Shark Bay, Western Australia to northern New South Wales) to southern Japan (Allen 1985, Newman 2002). It has also been identified from Tonga and Kosrae (R. Myers unpublished data) and Korea (Jeju Island; Kim&#160;<em>et al.</em> 2012). There are unsubstantiated records from East Africa (Allen 1985). It is found at depths ranging from 12 to 140 m (Anderson and Allen 2001, R. Myers pers. comm. 2015).","This highly commercial species is caught mainly by trawl as well as handlines and bottom longlines (Anderson and Allen 2001). It is considered an excellent food fish (Allen 1985). It is heavily exploited in commercial and artisanal fisheries of the Persian Gulf, Gulf of Oman and Socotra Island, Yemen (Al-Husaini&#160;<em>et al.&#160;</em>2015, Hassan Ali&#160;<em>et al.&#160;</em>2016), southern India (Murugan&#160;<em>et al</em>. 2014) and Malaysia (Bachok <em>et al</em>. 2004).&#160;It is targeted alongside&#160;<em>Lutjanus erythropterus&#160;</em>by commercial and recreational fisheries across its range in Australia (Martin&#160;<em>et al. </em>2014, Northern Territory Government 2015).&#160;It is also exploited in Papua New Guinea and Indonesia by commercial, artisanal and recreational fishers, and some portion of the catch is exported for sale in international markets (Blaber&#160;<em>et al</em>. 2005, Salini&#160;<em>et al</em>. 2006).&#160;It is farmed from hatchery-sourced fry in the mariculture industry of mainland south China (Fang <em>et al</em>. 2016) and elsewhere in southeast Asia where this industry is present (Mazumder <em>et al</em>. 2016). It is also a popular fish for commercial aquariums (Jonklaas 1975).",Marine,"The commercial fisheries of Australia are stringently managed under a total allowable catch limit, spatial zoning and gear restrictions. Recreational fishing is subject to bag limits (Martin<em> et al.</em> 2014). The Indonesian fisheries are largely unregulated with some commercial fishing licensing regulation (Blaber&#160;<em>et al.</em>&#160;2005, Fry&#160;<em>et al.</em>&#160;2009). It occurs in marine protected areas within its range.","",,false,false,Global
2343263,194505,Oryzias songkhramensis,Data Deficient,,2012,2011-02-22 00:00:00 UTC,3.1,English,"This species occurs in the Songkhram and Mekong river basins in northeast Thailand and central Laos, where it is currently known from a total of 74 specimens. It has been found in clear water ditches and paddy fields. Currently, the most important threat to this species is the possible  cessation of irrigation of paddy fields or water flow to drainage  channels causing the known habitats of this species to dry up. As so little information is known about this species, it is assessed as Data Deficient.","This species has been found in clear water ditches and paddy fields with sand, detritus or mud substrate (Magtoon 2010); also found in swamps and shallow pools","Currently, the most important threat to this species is the possible cessation of irrigation of paddy fields or water flow to drainage channels causing the known habitats of this species to dry up (L. Parenti pers. comm. 2011).",This species was described from a total of 52 type specimens collected in Thailand. It has been collected from a total of five separate localities in Thailand and Lao PDR and is known from a total of 74 specimens (Magtoon 2010). No other information on population is available.,Unknown,This species is known from the Songkhram and Mekong river basins in northeast Thailand (Nong Khai Province) and central Lao PDR (Magtoon 2010).,The species is found in the ornamental fish trade.,Freshwater (=Inland waters),There are no conservation actions in place for this species.,Indomalayan,,false,false,Global
2757362,202856,Bufoniceps laungwalaensis,Least Concern,,2021,2019-09-04 00:00:00 UTC,3.1,English,"Listed as Least Concern on the basis that, while this species has a known extent of occurrence of 10,000 km<sup>2 </sup>and threats from human intrusion into, and afforestation of, its dune habitat exist, at present these are localized and the species consequently does not occur at fewer than 10 locations or as a severely fragmented population.","This species is restricted to barren, or shifting, dunes interspersed by hard interdunal depressions. These areas and the edges of the dunes usually have permanent vegetation and rodent burrows.<span class=""Apple-converted-space"">&#160;Within this barren dune habitat, this species can be found on all parts of the sand dunes, including the crest, slopes, edges, and interdunal areas, evidenced by direct sightings, following tracks, and published observations (Sharma 2002).","Increased human and camel traffic can adversely affect barren dune species through trampling, which has been shown to affect lizards in sandy areas by breaking the top crust and loosening the soil (Agarwal <em>et al. </em>2009). It is likely to be strongly affected by habitat alteration. The barren dunes in this area face threats largely from tourism and the afforestation of dunes (Agarwal<em> et al.</em> 2009). Although these are thought to be genuine threats, impacts are localized within this species' range (R. Vyas pers. comm. 2019).",This species has been found to occur at an average density of 10 individuals/ha (range 8-12) through repeated sampling in the Thar Desert (Agarwal<em> et al</em>. 2009).,Unknown,"This species is endemic to the Thar Desert,&#160;Jaisalmer District,&#160;in India, in western Rajasthan (Sharma 2002). Records exist from Dhanana,&#160;Laungwala, Lunar (near Dhanana), Mandla, Sam and Tanot, Rajasthan (Prakash 1972, as <em>Phrynocephalus&#160;eutilopus</em>) (Sharma 1978, Arnold 1992, Tikader and Sharma&#160;1992). It may range to Sinh in Pakistan (Agarwal <em>et al.</em> 2009).","There is no significant use of or trade in this species.<span class=""Apple-converted-space"">",Terrestrial,"This lizard occurs in Desert National Park. Clarification of the species' full distribution in India and clarification of its occurrence in Pakistan is recommended. Research is recommended into the biology and ecology of this species, and into the impacts of tourism.",Indomalayan,,false,false,Global
2769438,203659,Bothriechis marchi,Endangered,"B1ab(iii,v)",2014,2012-05-07 00:00:00 UTC,3.1,English,"This species is assessed as Endangered because it has a small EOO (~4650 km<sup>2</sup>), occurs in only five locations, is restricted to intact forest, and is suffering from observed and inferred ongoing declines due to numerous factors (habitat loss, collapse of prey populations, and extraction for the pet trade).","This species is associated with intact, closed-canopy mid elevation rainforest. It is associated with streams, although it can also occur away from watercourses. Frogs are important prey items (Townsend and Wilson 2008).","This species is threatened by ongoing deforestation for timber extraction and the expansion of the agricultural frontier. This species is also threatened by extraction for the pet trade. For example the Honduras authorities have issued permits for exportation of hundreds of individuals annually (J. Townsend, unpubl. data). Furthermore, the crash in amphibian populations threatens this species.","This species is in sharp decline due to numerous threats. The species was regularly observed in the 1980s, and by the 2000s the species was much less common (L. Wilson, unpubl. data).",Decreasing,"This species primarily occurs in northern Honduras and may extend into extreme eastern Guatemala (Campbell and Lamar 2004). Its reported range is from 500 m to above 1,500 m in elevation, although it is probably rare below 900 m. Although there is one record from Nicaragua  (Villa 1984) and a few specimens have been reported near sea level, those observations most probably represent erroneous locality data (Campbell and Lamar 2004).",This species is traded in the international pet trade.,Terrestrial,"This species occurs within Cusuco, Pico Bonito, and Pico Pijol National Parks and the Texiguat Wildlife Refuge. Conservation measures needed include greater resources to park operations as well as policies to prevent forest destruction. Trade in this species should be regulated under Appendix II of CITES as well as stricter national laws.",Neotropical,,false,false,Global
2769452,203662,Bothriechis thalassinus,Endangered,"B1ab(iii,v)",2021,2012-10-05 00:00:00 UTC,3.1,English,"This species is listed as Endangered because it has a restricted distribution, its population is severely fragmented, and there is continuing decline in the extent and quality of its habitat due to deforestation and in the number of mature individuals due to illegal collecting.","This is primarily a montane species occurring in lower montane wet forest and lower montane moist forest (Campbell and Lamar 2004).&#160;It used to occur near streams, but it is now more frequently found in slopes above the streams. At least historically it preyed on streamside frogs (<em>Craugastor </em>species), which were lost from or declined in much of the snake's range during the 1980s.","The main threats to this species are the illegal pet trade, deforestation for timber extraction, cattle raising and agriculture, and the disappearance of its prey species..","This species used to be fairly abundant, but since the disappearance of its prey species (streamside frogs of the genus <em>Craugastor</em>) in the 1980s, the population of this snake appears to be declining.",Decreasing,"This species is found in extreme western Honduras and extreme eastern Guatemala (Montañas de la Union y Sierra Caral) from 885-2,180 m elevation (Campbell and Lamar 2004; J. Townsend pers. comm. 2012). It occurs only in mountain tops and its distribution is severely fragmented.","This species is heavily exploited for the legal and illegal pet trade. In 2005, 155 individuals were reported in exports from Honduras.",Terrestrial,It occurs in Santa Barbara and Cerro Azul de Copan National Parks in Honduras and one protected area (Parque Regional Municipal de la Union) in Guatemala. This species is not in CITES. Legislation and enforcement is urgently needed to regulate the commercialization of this species. Research is needed to determine whether the different subpopulations belong to the same species,Neotropical,,false,false,Global
