assessmentId,internalTaxonId,scientificName,redlistCategory,redlistCriteria,yearPublished,assessmentDate,criteriaVersion,language,rationale,habitat,threats,population,populationTrend,range,useTrade,systems,conservationActions,realm,yearLastSeen,possiblyExtinct,possiblyExtinctInTheWild,scopes
53817298,49829702,Bryconacidnus ellisi,Least Concern,,2016,2014-04-24 00:00:00 UTC,3.1,English,"<p><span lang=""EN-US"">&#160;This species is listed as Least Concern because it is widely distributed, common, present in many protected areas, and because there are no major widespread threats currently affecting its population.</p>",<p>This is a tropical pelagic freshwater fish (Froese and Pauly 2013).</p>,"<p>This species may be affected by habitat modification and pollution produced by agriculture, gold mining, and use of natural poison for fishing.</p>","<p>There are no data on population size and trends for this species, but it seems to be common.</p>",Unknown,"This species occurs in the Madre de Dios, Urubamba, and Ucayali River basins in Peru (Ortega <em>et al.</em> 2012) and in the Beni, Mamore and Itenez River basins of Bolivia (Lauzanne <em>et al.</em> 1991, Chernoff <em>et al. </em>2000, Carvajal-Vallejos <em>et al</em>. 2014). Its type locality is&#160;Espia, Bolivia (Pearson&#160;1924). It occurs at elevations between 130 m and 1,520 m.",This species is not utilized.,Freshwater (=Inland waters),There are no conservation measures in place for this species. It is present in several protected areas throughout its distribution.,Neotropical,,false,false,Global
53818543,49830568,Phreatobius sanguijuela,Critically Endangered,B2ab(iii),2016,2014-04-24 00:00:00 UTC,3.1,English,"<p><span lang=""EN-US"">This species is listed as Critically Endangered because its distribution is restricted to a community well, and there is continuing decline in the number of mature individuals due to by-catch when extracting water. There is also continuing decline in the quality of the habitat due to chlorination of the water for purification. Monitoring of the population and education programs with the local communities are recommended. <br/></p>","This species lives in subterranean waters between 6 and 12 m of depth. The water depth of the well where it was found was approximately 1 m, with silty, loose sandy bottom and uncoated walls (Van Damme&#160;<em>et al.&#160;</em>2009). It is believed to have a diet similar to two individuals observed in captivity, (Muriel-Cunha and de Pinna 2005, Shibatta <em>et al. </em>2007), which consists on mature and immature insects and other invertebrates (Carvajal-Vallejos and Fernández 2008 in&#160;Van Damme<em> et al.</em> 2009).","The main threats to this species are by-catch and killing because it is seen as a risk for human health. They are generally mistaken for leeches due to its bright, blood-red coloration (Fernandez <em>et al.</em> 2007). It is potentially threatened due to chlorination of the water for purification in the majority of the surrounding domestic wells (Carvajal-Vallejos and Fernández 2008 in&#160;Van Damme<em> et al.</em> 2009,&#160;Van Damme et al. 2011).","It is only known from one population, being rarely captured and their abundance suspected to be very low.&#160;Its population size is unknown (Carvajal-Vallejos and Fernández 2008 in&#160;Van Damme&#160;<em>et al.&#160;</em>2009, Van Damme <em>et al</em>. 2011).",Unknown,"This species occurs in Bolivia in the Iténez River basin (Carvajal-Vallejos and Zeballos Fernández 2011). It is only known from the type locality in the Porvenir community (13°59'14.44""S, 61°32'27.05""W), Santa Cruz department, approximately 2 km off the Paraguá River, in the Iténez River basin at 172 m of elevation (Fernández&#160;<em>et al.</em>&#160;2007, Carvajal-Vallejos and Fernández 2008, Van Damme <em>et al. </em>2009). The area of occupancy is estimated to be 4 km² (overlaying a grid cell of 2 x 2 km on the only known locality). Based on the main threat affecting it (by-catch mortality), this species appears to occur at only one location.",This species is not used or traded.,Freshwater (=Inland waters),"It is present in a locality adjacent to the Lower Paraguá Noel Kempff Mercado National Park&#160;Original Community Reserve (or TCO). It is listed as Vulnerable in the Red Book of Bolivia, 2008 (Carvajal-Vallejos and Fernández 2008 in&#160;Van Damme&#160;<em>et al.&#160;</em>2009).&#160;&#160;The proposed conservation means are to elaborate an education project, to inform local communities living in the surroundings of the type locality about this species' most outstanding features, emphasizing that it is not a threat to humans and about its value as water quality indicator. Research is needed to collect additional information on its distribution, habitat, ecology, life history, anatomy and phylogenetic relationships (morphological and molecular) (Carvajal-Vallejos and Fernández 2008 in Van Damme<em>&#160;et al.&#160;</em>2009).",Neotropical,,false,false,Global
54909454,107261198,Hippocampus pontohi,Least Concern,,2017,2016-08-24 00:00:00 UTC,3.1,English,"<p><span style=""font-style: italic;"">Hippocampus pontohi</span> is a coastal pygmy seahorse species that inhabits waters in the Indo-West Pacific from Indonesia to Fiji and from the Ryukyu Islands to southern Papua New Guinea. Their habitat includes hydroids, bryozoans, and algae, most notably of the genus <em>Halimeda</em>. &#160;The species may be susceptible to <em>Halimeda </em>habitat loss as a result of ocean acidification, but is able to utilise other habitats. It is listed on CITES Appendix II. Therefore&#160;<span style=""font-style: italic;"">Hippocampus pontohi</span>&#160;is listed as Least Concern.&#160;</p>","<p><em>Hippocampus pontohi</em> is found among algae, bryozoans, and hydroid crops, especially the coralline algae <span style=""font-style: italic;"">Halimeda</span> and hydroid <span style=""font-style: italic;"">Aglaephenia cupressina</span> (Lourie and Kuiter 2008). Little is known about their feeding, but they likely have diets similar to other seahorses, which include small crustaceans such as caprellid, gammarid, and caridean shrimps and harpacticoid copepods (Woods 2002, Kendrick and Hyndes 2005, Kitsos<em> et al. </em>2008). As is exhibited in other seahorses, they are ovoviviparous and the males brood the young in a pouch prior to giving live birth (Foster and Vincent 2004).&#160;<br/>&#160;<br/>This species is extremely small in size, with a height of 14 mm and a standard length of 17 mm (Lourie and Kuiter 2008).<br/>&#160;<br/>They are&#160;commonly found in pairs and are relatively active. Two of the specimens collected were pregnant and each contained 11 embryos (Lourie and Kuiter 2008).</p>","The threats to this species are unknown. Their most commonly observed substrate, <em>Halimeda </em>algae, which exhibits calcium carbonate defensive and structural tissues, is likely susceptible to declines because of ocean acidification (Robbins <em>et al. </em>2009, Price<em> et al</em>. 2011, Sinutok e<em>t al</em>. 2012). Further research is needed in order to determine how much <em>H. pontohi </em>depends on <em>Halimeda</em>, and how ocean acidification is affecting the <em>Halimeda</em> populaiton.",To date there have been no dedicated surveys or population estimates for <em>Hippocampus pontohi</em>. Further research is needed in order to determine population size and trends in abundance for this species.,Unknown,"<p><em>Hippocampus pontohi </em>inhabits waters in the Indo-West Pacific from southern Sumatra to Fiji and from the Ryukyu Islands to southern Indonesia and Papua New Guinea, including the Solomon Islands (Kanagawa Prefectural Museum of Natural History 2010, Lourie <em>et al.</em> 2016).&#160;</p>","There are no records of trade in&#160;<em>Hippocampus pontohi.</em>&#160;Although the species is likely attractive for the aquarium trade, they are notoriously hard to find and do not do well in captivity.",Marine,"There are no species-specific conservation measures in place for <em>Hippocampus pontohi</em>. The species is found in several protected areas, including Bunaken National Park, Indonesia. It is listed on CITES Appendix II.&#160;Further research is needed in order to determine how much&#160;<em>H. pontohi&#160;</em>depends on&#160;<em>Halimeda</em>, and how ocean acidification is affecting&#160;<em>Halimeda</em>&#160;populations.",Australasian|Indomalayan,,false,false,Global
60612143,172368,Etroplus suratensis,Least Concern,,2019,2019-07-29 00:00:00 UTC,3.1,English,"<p>The species is widespread and, while it is declining in parts of  its range, it is not thought that any global population decline is  likely to meet (or be close to meeting) the threshold for Vulnerable.  Therefore the species is assessed as Least Concern.</p>","<em>Etroplus suratensis</em> is a&#160;euryhaline species that inhabits mainly brackish water and river mouths. It is an oval-shaped cichlid with a&#160;short&#160;snout,&#160;small&#160;mouth not extending past the front margin&#160;of the eye with a greyish-green colouration on the flanks,&#160;with 6 to 8 dark bars and a dark spot at base of the pectoral fin. Most scales on the sides are with a pearly spot (Costa 2007).&#160;Macrophytic fragments form the most important component of its diet along with&#160;molluscs, although detritus, diatoms, and animal matter are also ingested (De Silva <em>et al.</em> 1984). Many aspects of this species was studies in order to assess its suitability for culture in ponds and tanks by Jayaprakash <span style=""font-style: italic;"">et al.</span> (1990). Adults engage in altruistic multiple parental care where several adults care for a single brood that, presumably, were spawned by only two of the adults (Ward and Wyman 1977). In Sri Lanka,&#160;<em>E. suratensis is </em>primarily found in brackish water but known to tolerate fresh or marine waters for short periods. It is found in large rivers, reservoirs, lagoons and estuaries. Species feeds exclusively on algae and macrophytic plant material (De Silva <em>et al</em>. 2015, Pethiyagoda 1991, Senanayake 1980).","Wild populations of&#160;<em>Etroplus suratensis</em> are subject to various pressures brought on by people, such as habitat deterioration due to disposal of solid and liquid wastes, the discharge of human fecal matter from adjacent habitations and an increasing number of tourism resorts and houseboats, which are going beyond the carrying capacity of the backwaters/estuaries. A major threat is from exotic species like <span style=""font-style: italic;"">Oreochromis mossambicus </span>and&#160;<span style=""font-style: italic;"">Trichogaster trichopterus </span>(Kurup 2007, Krishnakumar <em>et al.</em> 2009). There have also been reports in the past, of the Epizootic Ulcerative Syndrome (EUS) disease outbreak, which has been known to have spread in South and south-east Asia since 1980 (Pathiratne and Rajapakshe 1998).","This is a widespread and common species. However, it is known to be declining in parts of its range.",Decreasing,"<em>Etroplus suratensis</em> is distributed in the coastal regions of peninsular India and Sri Lanka. In India, the wild populations have been recorded from the states of Kerala and Tamil Nadu. There are also populations in Goa, Andhra Pradesh, Orissa and West Bengal (Jayaram 1981, 2010, Biju 2005). These are likely introduced populations (V.S. Basheer pers. comm. 2019). The species has now been introduced to dam reservoirs in the mountains and lakes and culture ponds (Rema Devi <span style=""font-style: italic;"">et al.</span> 2005). In Sri Lanka it is widespread throughout the country except in the highlands (De Silva<em> et al</em>. 2015).","<em>Etroplus suratensis</em>&#160;is a popular foodfish. It is known locally as&#160;Karimeen and is considered a&#160;delicacy. The species has been introduced to various other&#160;man-made&#160;habitats like tanks, ponds and dam reservoirs for culture and export. In Sri Lanka it is<em> </em>a popular source of food for human consumption and Pethiyagoda (1991) and Gunasekara (2011) have both indicated that a few numbers are exported for international aquarium trade.",Freshwater (=Inland waters),"Despite the species being in high demand, the wild populations of the species have not been given sufficient conservation attention. There have been attempts in the past to create 'no fishing zones' within some of the larger estuaries and the species did seek refuge in these protected zones. Such 'no fishing zones' should be extrapolated to other regions as well, to guarantee effective genetic preservation. This species has been declared as the state fish by the government of Kerala. Captive breeding has been undertaken by Padmakumar <em>et al.</em> (2004) and an aquatic sanctuary was made in Vembanad Lake for this species. The Vembanad lake protection forums has started 'Matsyatavalam' (home of fishes) for the sustainable fisheries of this species. Cage culture of this species is being practiced in Vembanad Lake and Vypin Islands.",Indomalayan,,false,false,Global
69801022,69799447,Pterois antennata,Least Concern,,2016,2015-03-03 00:00:00 UTC,3.1,English,This species is widespread and very common throughout the Indo-Pacific. There are no known major threats.&#160;It is therefore listed as Least Concern.,"<em>Pterois antennata </em>is a reef-associated species found at depths of 2 to 50 meters, and even up to 76 meters (Poss 1999). This species is either solitary or is sometimes found in small groups, and can reach a maximum length of 15 centimeters SL (H. Motomura unpublished data). It<em> </em>is uncommon during the day due to the fact that they hide under rock and coral formations, and become active at night in order to hunt. This species feeds on shrimp and crabs (Poss 1999).","<p>The level of exploitation in fisheries and the aquarium trade is not suspected to be a major threat at this time. Due to its affinity with coral reefs, we suspect that this species&#160;may be experiencing population declines due to habitat loss in parts of its range. &#160;However, this species also occupies rocky reefs, and therefore significant global population declines are not suspected.</p><p>As of 2008, 15% of the world's coral reefs were considered under imminent threat of being ""Effectively Lost"" (with 90% of the corals lost and unlikely to recover soon), with regions in East Africa, South and South-east Asia, and the wider Caribbean being the most highly threatened (Wilkinson&#160;<em>et al</em>. 2008).&#160;Of 704 zooxanthellate reef-building coral species which were assessed by using the International Union for Conservation of Nature Red List Criteria, 32.8% are in categories with elevated risk of extinction (Carpenter&#160;<em>et al</em>. 2008).</p>","This species is very common throughout its range (H. Motomura pers. comm. 2015).&#160;There are 290 museum records of this species that were collected from Oceania (Accessed through Fishnet2 Portal, www.fishnet2.net, 2015-01).",Unknown,"<em>Pterois antennata </em>is widely distributed&#160;throughout the Indo-West Pacific, from east Africa and South Africa to French Polynesia, north to southern Japan and south to Australia (Allen and Erdmann 2012), but is absent from Hawaii (Poss 1999). It is found at depths of 1 to 76 m (Poss 1999).","This species is found in subsistence fisheries, but does not support large scale fisheries due to its small size and dangerous spines. It<em> </em>is also commonly found in the aquarium trade (Poss 1999).",Marine,There are no species-specific conservation measures in place.,"",,false,false,Global
77338253,178190,Tarentola americana,Least Concern,,2017,2016-12-13 00:00:00 UTC,3.1,English,"<em>Tarentola americana</em> has been assessed as Least Concern. This species has a wide distribution across Cuba and the Bahamas, is abundant in places, and can inhabit anthropogenic environments.","This species is found on cliffs, in caves, around coconut trees, and in house walls and rafters.","This species is associated with caves, which are often severely impacted by even minimal human disturbance (Buide 1966, Dodd 2003) - such as, at least historically, by bat guano collection (S.D. Buckner pers. comm. 2015). Nevertheless, at present there are not thought to be any major threats across its range as a whole.","This species has been reported to be rare throughout its range (Schwartz 1968), but it is abundant in suitable habitat (Buide 1966, Henderson and Powell 2009).",Unknown,"This species is found throughout Cuba, including Isla de la Juventud and the Archipiélago de Sabana-Camagüey, and on the Great Bahama Bank (Díaz and Hedges 2008, Henderson and Powell 2009). The range of the Bahamas endemic subspecies <em>Tarentola americana warreni</em> includes the islands of Andros, Eleuthera, Great Exuma Island, Long Island, the Ragged Island range (Great Ragged, Little Ragged, Flamingo Cay, and Water Cay), and many smaller islands in between.",There is no known use of or trade in this species.,Terrestrial,"It is likely that this species occurs in several protected areas of Cuba, and it has been recorded in Exuma Cays Land and Sea Park in the Bahamas (S.D. Buckner pers. comm. 2015). Additional surveys would be valuable.",Neotropical,,false,false,Global
81468224,11208,Entosphenus macrostoma,Endangered,B1ab(iii)+2ab(iii),2017,2015-07-22 00:00:00 UTC,3.1,English,"The species is endemic to Cowichan and Mesachie lakes (which are connected) and their lower in-flowing tributaries, on southern Vancouver Island, British Columbia. The species is currently threatened by a decline in its primary prey species (Coho Salmon, <em>Oncorhynchus kisutch</em>), and also by sedimentation from logging, and persecution from recreational anglers. It has an area of occupancy (AOO) of 65 km², and an extent of occurrence (EOO) of 106 km², and is known from only one location based on the major threat to the species. Therefore the species is assessed as Endangered.","The species spawns on shallow gravel bars in nearshore lake habitat. After hatching, the larval lampreys (ammocoetes) burrow into soft fine sediments or sand. The juvenile lampreys likely seek prey (young salmonids especially coho salmon) in the open lake (COSEWIC 2008). After spawning the adults die.","There has been a significant decline in the abundance of their most commonly observed prey (Coho Salmon, <em>Oncorhynchus kisutch</em>). The species is also persecuted by recreational anglers, and logging is leading to siltation of littoral spawning areas. Potential threats include development for residential and industrial uses on littoral areas and increasing levels of water extraction (leading to water level fluctuations).","It is estimated that there is between 1,000 and 2,000 individuals in both lakes, but this needs quantifying (COSEWIC 2008).&#160;Changes in salmonid scarring rates (an index of the number of adult lampreys) suggest that the number of Vancouver Lampreys in 1987-1996 (in Mesachie Lake, at least) are lower than they were prior to 1982, however current population trends are unknown.",Unknown,"The species is endemic to&#160;Cowichan and Mesachie lakes (which are connected) and their lower in-flowing tributaries, on southern Vancouver Island, British Columbia,&#160;Canada (COSEWIC 2008). Its area of occupancy is estimated at 65 km² (area of the lake), and its extent of occurrence (based on a minimum convex polygon) is 106 km². The species occurs at only one location, based on the main threat affecting the species.",,Freshwater (=Inland waters),"There is a recovery strategy for the species (Vancouver Lamprey Recovery Team 2007), which aims to increase the scientific understanding of the species, improve awareness of the species and engage with local stakeholders and maintain and improve the species population and habitat integrity.",Nearctic,,false,false,Global
94613700,103811224,Foudia eminentissima,Least Concern,,2016,2016-10-01 00:00:00 UTC,3.1,English,"Although this species may have a restricted range, it is not believed to approach the thresholds for Vulnerable under the range size criterion (extent of occurrence &lt;20,000 km<sup>2</sup> combined with a declining or fluctuating range size, habitat extent/quality, or population size and a small number of locations or severe fragmentation). The population trend is currently considered to be stable, and hence the species does not approach the thresholds for Vulnerable under the population trend criterion (&gt;30% decline over ten years or three generations). The population size has not been quantified, but it is not believed to approach the thresholds for Vulnerable under the population size criterion (&lt;10,000 mature individuals with a continuing decline estimated to be &gt;10% in ten years or three generations, or with a specified population structure). For these reasons the species is evaluated as Least Concern, although further information regarding population trends across its range may mean this species warrants uplisting in the future.",,"This species may be affected by nest predation by species such as Black Rat (<em>Rattus rattus</em>), Brown Lemur (<em>Eulemur fulvus</em>) and Mongoose Lemur (<em>E.&#160;mongoz</em>). Additionally, cyclones, mangrove destruction, disease, poisoning and competition with House Sparrows (<em>Passer domesticus</em>) may be an issue for this species, particularly on Mayotte (Safford and Louette 2013).","On Mayotte, the population may number 5,000-10,000 individuals (Rocamora 2004), roughly equivalent to 3,333-6,667 mature individuals. With a density of &lt;27 males per km2&#160;on Mohéli, and lower densities on Anjouan (Safford and Louette 2013), the population is suspected to fall in the range of 10,000-19,999 mature individuals.",Stable,,,Terrestrial,,Afrotropical,,false,false,Global
